"DESCRIPTION","DURATION IN MS","NAME","PARENT SUITE","START TIME","STATUS","STOP TIME","SUB SUITE","SUITE","TEST CLASS","TEST METHOD"
"","1365","should display the correct error message for invalid credentials","chromium","Thu Mar 12 23:25:27 UTC 2026","passed","Thu Mar 12 23:25:28 UTC 2026","Login tests","ui/login.spec.ts","",""
"","11527","should be able to create a task correctly","chromium","Thu Mar 12 23:26:33 UTC 2026","failed","Thu Mar 12 23:26:45 UTC 2026","Task Management","ui/today.spec.ts","",""
"","10526","TC04 - Delete task successfully","chromium","Thu Mar 12 23:27:13 UTC 2026","failed","Thu Mar 12 23:27:24 UTC 2026","Task Management","ui/today.spec.ts","",""
"","10272","TC03 - Create task successfully from sidebar","chromium","Thu Mar 12 23:25:54 UTC 2026","failed","Thu Mar 12 23:26:04 UTC 2026","Sidebar tests","ui/sidebar.spec.ts","",""
"","4964","should be able to login correctly","chromium","Thu Mar 12 23:25:22 UTC 2026","passed","Thu Mar 12 23:25:27 UTC 2026","Login tests","ui/login.spec.ts","",""
"","5102","Should dismiss add task modal","chromium","Thu Mar 12 23:27:25 UTC 2026","passed","Thu Mar 12 23:27:30 UTC 2026","Page Functionality","ui/today.spec.ts","",""
"","1312","should be able to create a task via API correctly for today","chromium","Thu Mar 12 23:25:21 UTC 2026","passed","Thu Mar 12 23:25:22 UTC 2026","API - Create Task","api/create.spec.ts","",""
