"DESCRIPTION","DURATION IN MS","NAME","PARENT SUITE","START TIME","STATUS","STOP TIME","SUB SUITE","SUITE","TEST CLASS","TEST METHOD"
"","5724","should be able to login correctly","chromium","Wed Mar 11 21:09:55 UTC 2026","passed","Wed Mar 11 21:10:01 UTC 2026","Login tests","ui/login.spec.ts","",""
"","6579","should be able to create a task correctly","chromium","Wed Mar 11 21:10:40 UTC 2026","passed","Wed Mar 11 21:10:46 UTC 2026","Task Management","ui/today.spec.ts","",""
"","9631","TC03 - Create task successfully from sidebar","chromium","Wed Mar 11 21:10:29 UTC 2026","failed","Wed Mar 11 21:10:39 UTC 2026","Sidebar tests","ui/sidebar.spec.ts","",""
"","1717","should display the correct error message for invalid credentials","chromium","Wed Mar 11 21:10:01 UTC 2026","passed","Wed Mar 11 21:10:03 UTC 2026","Login tests","ui/login.spec.ts","",""
"","1670","should be able to create a task via API correctly for today","chromium","Wed Mar 11 21:09:53 UTC 2026","passed","Wed Mar 11 21:09:55 UTC 2026","API - Create Task","api/create.spec.ts","",""
